{"schema_version":"task-revision.v1","protocol":"worldeval-conversation/0.1.0","revision_id":"revision-1","task_id":"task-1","from_revision":0,"to_revision":1,"cause":"human_correction","source":{"observation_seq":5,"tick":15,"state_hash":"sha256:2222222222222222222222222222222222222222222222222222222222222222"},"supersedes_task_hash":"sha256:3333333333333333333333333333333333333333333333333333333333333333","new_task_hash":"sha256:4444444444444444444444444444444444444444444444444444444444444444"}
